{
  "$schema": "../../../planning-contracts/planning-contract.schema.json",
  "useCase": {
    "id": "UC-02-04",
    "name": "Complete the admission form from an invite link",
    "module": "Admissions & Inquiry Management",
    "file": "../UseCases/UC-02-04.json",
    "featureRef": "2.4 Admission form completion"
  },
  "planned": false,
  "notPlanned": {
    "reason": "The form is reached by a single-use invite link and not by signing in, so the actor has no session and no allow-list — and the invite is spent by the submission, which makes it a thing only the family can do once.",
    "requestsThatArriveHere": [
      "fill in the admission form for this family",
      {
        "text": "in ka admission form bhar do",
        "lang": "ur-Latn",
        "gloss": "fill in their admission form"
      },
      {
        "text": "unko form ka link dobara bhejo",
        "lang": "ur-Latn",
        "gloss": "send them the form link again"
      },
      "upload the birth certificate for this applicant",
      {
        "text": "form aa gaya?",
        "lang": "ur-Latn",
        "gloss": "has the form come in?"
      }
    ],
    "routeInsteadTo": [
      {
        "request": {
          "text": "in ka admission form bhar do",
          "lang": "ur-Latn",
          "gloss": "fill in their admission form"
        },
        "goesTo": "No intent. The family completes it themselves.",
        "note": "The declaration (BR-5 and the Declaration field) is the family confirming their own information is correct. A form completed by anyone else makes that confirmation false."
      },
      {
        "request": {
          "text": "unko form ka link dobara bhejo",
          "lang": "ur-Latn",
          "gloss": "send them the form link again"
        },
        "goesTo": "admission.invite.resend — UC-02-03",
        "note": "Resending an invite is the School Admin's act on the inquiry, and it is planned."
      },
      {
        "request": "this link has expired, give them a new one",
        "goesTo": "admission.invite.resend — UC-02-03",
        "note": "An expired invite is reissued from the inquiry (BR-5 of UC-02-03). The approval stands."
      },
      {
        "request": {
          "text": "form aa gaya?",
          "lang": "ur-Latn",
          "gloss": "has the form come in?"
        },
        "goesTo": "A read of the applicant list, not an act.",
        "note": "Whether a form has arrived is a question about state. It belongs with the applicant list, wherever that is written."
      },
      {
        "request": "schedule their test",
        "goesTo": "admission.test.schedule — UC-02-05",
        "note": "The next planned act after a form arrives."
      }
    ]
  },
  "contracts": []
}
