{
  "$schema": "../../../planning-contracts/planning-contract.schema.json",
  "useCase": {
    "id": "UC-04-03",
    "name": "Pay a fee online through the gateway from the parent app",
    "module": "Fee",
    "file": "../UseCases/UC-04-03.json",
    "featureRef": "4.3 Online / digital fee payment"
  },
  "planned": false,
  "notPlanned": {
    "reason": "The act that authorises the charge is the guardian's own, performed at the gateway outside this system — and BR-10 forbids anyone initiating an online payment on a family's behalf, which is exactly what a plan would be.",
    "requestsThatArriveHere": [
      "pay this invoice online",
      {
        "text": "is bill ki online payment kar do",
        "lang": "ur-Latn",
        "gloss": "make the online payment for this bill"
      },
      {
        "text": "parent ki taraf se fees jama kar do",
        "lang": "ur-Latn",
        "gloss": "pay the fees on the parent's behalf"
      },
      {
        "text": "card se pay kar do",
        "lang": "ur-Latn",
        "gloss": "pay it by card"
      },
      {
        "text": "family keh rahi hai unhone online pay kiya tha",
        "lang": "ur-Latn",
        "gloss": "the family say they paid online"
      },
      "the gateway payment is stuck as pending"
    ],
    "routeInsteadTo": [
      {
        "request": {
          "text": "parent ki taraf se fees jama kar do",
          "lang": "ur-Latn",
          "gloss": "pay the fees on the parent's behalf"
        },
        "goesTo": "No intent. The guardian pays in the app themselves.",
        "note": "Accounts do not initiate an online payment on a family's behalf; the guardian's own act is what authorises the charge (BR-10). Nothing here can stand in for it."
      },
      {
        "request": "pay this invoice online",
        "goesTo": "No intent, even in a guardian's own session.",
        "note": "The attempt only matters once the guardian has completed it at the gateway, which is outside this system entirely. An invoice is marked paid only on a confirmation the gateway returned (BR-1) — never because a request said so."
      },
      {
        "request": {
          "text": "family keh rahi hai unhone online pay kiya tha",
          "lang": "ur-Latn",
          "gloss": "the family say they paid online"
        },
        "goesTo": "fee.payment.record — UC-04-05, only against a gateway confirmation",
        "note": "Nothing is credited because the guardian says they paid (BR-1). A confirmed online payment is recorded automatically with no keying (UC-04-05 BR-8); an unconfirmed one is checked against the attempt log (BR-9)."
      },
      {
        "request": {
          "text": "bank se pay karna hai, challan do",
          "lang": "ur-Latn",
          "gloss": "we want to pay at the bank, give us the challan"
        },
        "goesTo": "fee.challan.generate — UC-04-04",
        "note": "Where the gateway is unavailable the invoice simply stays payable by the other routes (E4)."
      },
      {
        "request": {
          "text": "counter pe cash aaya hai",
          "lang": "ur-Latn",
          "gloss": "cash has come in at the counter"
        },
        "goesTo": "fee.payment.record — UC-04-05"
      },
      {
        "request": "the payment is stuck as pending",
        "goesTo": "No intent. The system queries it itself.",
        "note": "An attempt left pending past the configured window is queried against the gateway and resolved (BR-8). A payment is never left in limbo because a callback was lost, and nothing a plan does speeds that up."
      }
    ]
  },
  "contracts": []
}
