{
  "$schema": "../../../planning-contracts/planning-contract.schema.json",
  "useCase": {
    "id": "UC-01-01",
    "name": "Sign in with a system-issued username and start a session",
    "module": "Admin — system-wide",
    "file": "../UseCases/UC-01-01.json",
    "featureRef": "1.1 Login"
  },
  "planned": false,
  "notPlanned": {
    "reason": "A plan runs inside a controller session, and this use case is what creates one — there is no $session to execute against, and a credential must never travel through a planner as a request field.",
    "requestsThatArriveHere": [
      "log me in",
      {
        "text": "mujhe login kara do",
        "lang": "ur-Latn",
        "gloss": "log me in"
      },
      "sign in as the accounts user",
      {
        "text": "mera password kaam nahi kar raha",
        "lang": "ur-Latn",
        "gloss": "my password is not working"
      },
      "my password is not working",
      {
        "text": "account lock ho gaya hai, khol do",
        "lang": "ur-Latn",
        "gloss": "the account is locked, open it"
      },
      {
        "text": "code dobara bhejo",
        "lang": "ur-Latn",
        "gloss": "send the code again"
      },
      "why am I locked out"
    ],
    "routeInsteadTo": [
      {
        "request": "log me in / sign me in as someone else",
        "goesTo": "No intent. The login screen only.",
        "note": "Credentials are entered on /login by the person holding them. An assistant that could sign a user in could sign anyone in, and BR-4 and BR-5 exist precisely so that the sign-in path discloses nothing. The request arriving in Roman Urdu changes nothing: mujhe login kara do is the same refusal as log me in."
      },
      {
        "request": {
          "text": "mera password kaam nahi kar raha / password reset kar do",
          "lang": "ur-Latn",
          "gloss": "my password is not working / reset my password"
        },
        "goesTo": "UC-25-05 — Password management",
        "note": "Owns the reset path, the policy and the lockout threshold. Whether it carries a planning contract is decided there."
      },
      {
        "request": {
          "text": "account lock ho gaya hai, khol do",
          "lang": "ur-Latn",
          "gloss": "the account is locked, open it"
        },
        "goesTo": "UC-25-05 — Password management, and UC-25-01 for the account state",
        "note": "The lock is a state on the account, not something a sign-in plan could clear."
      },
      {
        "request": {
          "text": "code dobara bhejo",
          "lang": "ur-Latn",
          "gloss": "send the code again"
        },
        "goesTo": "UC-25-04 — Multi-factor authentication",
        "note": "A resend belongs to the second-factor exchange, which is held open by the login screen and never by a plan."
      },
      {
        "request": {
          "text": "logout kar do",
          "lang": "ur-Latn",
          "gloss": "sign me out"
        },
        "goesTo": "session.end — UC-01-02",
        "note": "The one session operation that is planned."
      },
      {
        "request": "who am I signed in as / which branch am I in",
        "goesTo": "No call. The answer is already in $session.",
        "note": "Never plan a step to read back context the controller is holding."
      }
    ]
  },
  "contracts": []
}
