{
  "$schema": "../../../planning-contracts/planning-contract.schema.json",
  "useCase": {
    "id": "UC-02-01",
    "name": "Submit an inquiry through the public form",
    "module": "Admissions & Inquiry Management",
    "file": "../UseCases/UC-02-01.json",
    "featureRef": "2.1 Online inquiry form submission"
  },
  "planned": false,
  "notPlanned": {
    "reason": "The actor is a prospective family on the public website with no session, so there is no $session to plan against and no allow-list to plan within — the same reason login is not planned.",
    "requestsThatArriveHere": [
      "submit an inquiry for my daughter",
      {
        "text": "meri beti ke liye inquiry karni hai",
        "lang": "ur-Latn",
        "gloss": "I want to make an inquiry for my daughter"
      },
      {
        "text": "admission form kahan se milega?",
        "lang": "ur-Latn",
        "gloss": "where do I get the admission form?"
      },
      "add this family's enquiry to the system",
      {
        "text": "ye family ne phone kiya tha, inquiry daal do",
        "lang": "ur-Latn",
        "gloss": "this family phoned, put the enquiry in"
      },
      {
        "text": "mera bacha pehle yahan parhta tha, dobara admission chahiye",
        "lang": "ur-Latn",
        "gloss": "my child studied here before, I want re-admission"
      }
    ],
    "routeInsteadTo": [
      {
        "request": "submit an inquiry for my daughter",
        "goesTo": "No intent. The public inquiry form only.",
        "note": "A family fills the form themselves at the public address. Nothing in this layer submits on their behalf, because the submission stamps source Online Form (BR-1) and that stamp would then be false."
      },
      {
        "request": {
          "text": "ye family ne phone kiya tha, inquiry daal do",
          "lang": "ur-Latn",
          "gloss": "this family phoned, put the enquiry in"
        },
        "goesTo": "inquiry.record — UC-02-10",
        "note": "A staff member recording an enquiry taken by phone or in person is a different use case with a different source stamp. That one is planned."
      },
      {
        "request": {
          "text": "admission form kahan se milega?",
          "lang": "ur-Latn",
          "gloss": "where do I get the admission form?"
        },
        "goesTo": "No intent. UC-02-04, reached only by invite.",
        "note": "There is no public address for the admission form (BR-4). It is opened by the single-use invite issued at approval."
      },
      {
        "request": {
          "text": "mera bacha pehle yahan parhta tha",
          "lang": "ur-Latn",
          "gloss": "my child studied here before"
        },
        "goesTo": "Still the public form, with Re-admission ticked — UC-02-09",
        "note": "Re-admission starts as an ordinary inquiry with the box ticked (BR-5). The first planned act on it is confirming the match."
      },
      {
        "request": "check whether we already have this child on file",
        "goesTo": "inquiry.review — UC-02-02",
        "note": "The duplicate check is the reviewer's act, not the family's."
      }
    ]
  },
  "contracts": []
}
